{
  "$schema": "https://json-schema.org/draft/2020-12/schema",
  "$id": "https://obligationfirst.org/v1/schema/authority.schema.json",
  "title": "Authority",
  "description": "An organization with an evidenced legal, administrative, adjudicative, enforcement, or standards role. v0.6 does not infer authority from dataset ownership and does not require a fabricated authority basis when the source is silent.",
  "type": "object",
  "required": ["@type", "@id", "organization"],
  "properties": {
    "@context": { "type": ["string", "array", "object"] },
    "@id": { "type": "string", "format": "uri" },
    "@type": { "const": "of:Authority" },
    "organization": {
      "type": "object",
      "required": ["@type", "name"],
      "properties": {
        "@type": { "enum": ["gist:Organization", "gist:GovernmentOrganization"] },
        "name": { "type": "string", "minLength": 1 }
      },
      "additionalProperties": true
    },
    "authority_basis": {
      "anyOf": [
        { "$ref": "https://obligationfirst.org/v1/schema/common.schema.json#/$defs/authorityBasis" },
        {
          "type": "array",
          "items": { "$ref": "https://obligationfirst.org/v1/schema/common.schema.json#/$defs/authorityBasis" },
          "minItems": 1
        }
      ]
    },
    "jurisdiction": { "$ref": "https://obligationfirst.org/v1/schema/common.schema.json#/$defs/jurisdiction" },
    "territorial_scope": { "$ref": "https://obligationfirst.org/v1/schema/common.schema.json#/$defs/stringSet" },
    "institutional_scope": { "$ref": "https://obligationfirst.org/v1/schema/common.schema.json#/$defs/stringSet" },
    "roles": { "$ref": "https://obligationfirst.org/v1/schema/common.schema.json#/$defs/stringSet" },
    "sameAs": { "$ref": "https://obligationfirst.org/v1/schema/common.schema.json#/$defs/iriSet" },
    "exactMatch": { "$ref": "https://obligationfirst.org/v1/schema/common.schema.json#/$defs/iriSet" },
    "describesSameEntityAs": { "$ref": "https://obligationfirst.org/v1/schema/common.schema.json#/$defs/iriSet" },
    "source": { "type": "string", "format": "uri" },
    "source_citation": { "type": "string" },
    "source_locator": { "type": "string" },
    "source_version": { "type": "string" },
    "language": { "type": "string" },
    "evidence_type": { "type": "string" },
    "verified": { "type": "string", "format": "date" },
    "retrieved": { "type": "string", "format": "date" },
    "asserted_by_adopter": { "type": "string", "format": "uri" },
    "notes": { "type": "string" }
  },
  "additionalProperties": true
}
