{
  "@context": "https://obligationfirst.org/v1/context.jsonld",
  "@type": "of:Authority",
  "@id": "https://obligationfirst.org/v1/examples/publedge-jia-utah-72/authority/oaip",
  "organization": {
    "@type": "gist:GovernmentOrganization",
    "name": "Utah Office of Artificial Intelligence Policy (OAIP)"
  },
  "authority_basis": {
    "kind": "statutory",
    "instrument_ref": "https://everyailaw.com/instrument/utah-sb149.json"
  },
  "jurisdiction": {
    "@type": "of:Jurisdiction",
    "territorial_scope": [
      "us-ut"
    ]
  },
  "sameAs": [
    "https://publedge.org/authority/utah-oaip.json"
  ]
}
