{
  "@context": "https://obligationfirst.org/v1/context.jsonld",
  "@type": "of:Authority",
  "@id": "https://obligationfirst.org/v1/examples/colorado-sb24-205/authority/attorney-general",
  "organization": {
    "@type": "gist:GovernmentOrganization",
    "name": "Colorado Attorney General"
  },
  "authority_basis": {
    "kind": "regulatory",
    "instrument_ref": "https://obligationfirst.org/v1/examples/colorado-sb24-205/instrument/sb24-205"
  },
  "jurisdiction": {
    "@type": "of:Jurisdiction",
    "territorial_scope": [
      "us-co"
    ]
  },
  "sameAs": [
    "https://everyailaw.com/authority/colorado-ag.json"
  ]
}
