{
  "@context": "https://obligationfirst.org/v1/context.jsonld",
  "@type": "of:Authority",
  "@id": "https://obligationfirst.org/v1/examples/colorado-sb24-205/authority/federal-district-court",
  "organization": {
    "@type": "gist:GovernmentOrganization",
    "name": "United States District Court for the District of Colorado"
  },
  "authority_basis": {
    "kind": "judicial",
    "instrument_ref": "https://obligationfirst.org/v1/examples/colorado-sb24-205/instrument/us-constitution-article-iii"
  },
  "jurisdiction": {
    "@type": "gist:Jurisdiction",
    "ref": "us"
  },
  "sameAs": [
    "https://aiincidentlaw.org/authority/u-s-district-court-district-of-colorado.json"
  ]
}
