{
  "@context": "https://obligationfirst.org/v1/",
  "@type": "of:Authority",
  "@id": "https://obligationfirst.org/v1/examples/eu-ai-act-article-50/authority/european-commission",
  "organization": {
    "@type": "gist:GovernmentOrganization",
    "name": "European Commission (AI Office)"
  },
  "authority_basis": {
    "kind": "regulatory",
    "instrument_ref": "https://obligationfirst.org/v1/examples/eu-ai-act-article-50/instrument/ai-act#art-96"
  },
  "jurisdiction": {
    "@type": "gist:Jurisdiction",
    "ref": "eu"
  },
  "sameAs": [
    "https://everyailaw.com/authority/european-commission.json"
  ]
}
