{
  "@context": "https://obligationfirst.org/v1/context.jsonld",
  "@type": "of:Authority",
  "@id": "https://obligationfirst.org/v1/examples/air-canada/authority/bccrt",
  "organization": {
    "@type": "gist:GovernmentOrganization",
    "name": "British Columbia Civil Resolution Tribunal"
  },
  "jurisdiction": {
    "@type": "of:Jurisdiction",
    "territorial_scope": ["ca-bc"],
    "institutional_scope": ["British Columbia Civil Resolution Tribunal"]
  },
  "describesSameEntityAs": [
    "https://aiincidentlaw.org/authority/british-columbia-civil-resolution-tribunal.json"
  ]
}
