{
  "@context": "https://obligationfirst.org/v1/context.jsonld",
  "@type": "of:Authority",
  "@id": "https://obligationfirst.org/v1/examples/air-canada/authority/bccrt",
  "organization": {
    "@type": "gist:GovernmentOrganization",
    "name": "British Columbia Civil Resolution Tribunal"
  },
  "authority_basis": {
    "kind": "judicial",
    "instrument_ref": "https://obligationfirst.org/v1/examples/air-canada/instrument/bccrt-act"
  },
  "jurisdiction": {
    "@type": "gist:Jurisdiction",
    "ref": "ca-bc"
  },
  "sameAs": [
    "https://aiincidentlaw.org/authority/british-columbia-civil-resolution-tribunal.json"
  ]
}
